{"$schema":"https://json-schema.org/draft/2020-12/schema","$id":"https://catalog.local/schemas/v1/package-policy.schema.json","title":"package-policy","type":"object","additionalProperties":false,"required":["schema_version","policy_version","brand_scope","source_adapters","max_entries","max_entry_size","max_total_size","max_compression_ratio","forbid_nested_zip","fingerprint"],"properties":{"schema_version":{"const":"1.0.0"},"policy_version":{"type":"string"},"brand_scope":{"type":"array","items":{"type":"string"}},"source_adapters":{"type":"array","items":{"type":"string"}},"category_mapping_source":{"type":"string"},"provenance_source":{"type":"string"},"max_entries":{"type":"integer","minimum":1},"max_entry_size":{"type":"integer","minimum":1},"max_total_size":{"type":"integer","minimum":1},"max_compression_ratio":{"type":"number","minimum":1},"forbid_nested_zip":{"type":"boolean"},"fingerprint":{"$ref":"common-definitions.schema.json#/$defs/sha256"}}}
